{
  "type": "DIALOG",
  "name": "ModemStatus",
  "rect": [0,0,288,153],
  "style": ["DS_MODALFRAME","WS_POPUP","WS_BORDER","WS_SYSMENU"],
  "children": [
    {
      "type": "LTEXT",
      "content": "",
      "id": 1,
      "rect": [10,15,266,20],
      "flags": ["WS_CHILD","WS_VISIBLE","WS_GROUP"],
      "children": null
    },
    {
      "type": "LTEXT",
      "content": "",
      "id": 2,
      "rect": [21,46,244,20],
      "flags": ["WS_VISIBLE"],
      "children": null
    },
    {
      "type": "FLCBTN",
      "content": "gluModemStatus-1",
      "id": 3,
      "rect": [85,114,117,23],
      "flags": ["WS_CHILD","WS_VISIBLE","WS_TABSTOP","WS_HOTKEY","FB_HTEXTCENTER","FB_VTEXTCENTER","CTRL_ESCAPE"],
      "children": null
    }
  ]
}