{
  "type": "DIALOG",
  "name": "Video",
  "rect": [184,32,264,288],
  "style": ["DS_MODALFRAME","WS_POPUP","WS_SYSMENU"],
  "children": [
    {
      "type": "DEFPUSHBUTTON",
      "content": "video-1",
      "id": -2,
      "rect": [20,252,104,28],
      "flags": ["WS_CHILD","WS_VISIBLE","WS_TABSTOP","WS_HOTKEY","RC_BIGTEXT"],
      "children": null
    },
    {
      "type": "PUSHBUTTON",
      "content": "video-2",
      "id": -3,
      "rect": [140,252,104,28],
      "flags": ["WS_CHILD","WS_VISIBLE","WS_TABSTOP","WS_HOTKEY","RC_BIGTEXT"],
      "children": null
    },
    {
      "type": "SCROLLBAR",
      "content": "",
      "id": 1,
      "rect": [34,60,208,12],
      "flags": ["SBS_HORZ","WS_CHILD","WS_VISIBLE","WS_TABSTOP"],
      "children": null
    },
    {
      "type": "CHECKBOX",
      "content": "video-3",
      "id": 7,
      "rect": [12,91,240,10],
      "flags": ["WS_CHILD","WS_VISIBLE","WS_TABSTOP","WS_HOTKEY"],
      "children": null
    },
    {
      "type": "CHECKBOX",
      "content": "video-4",
      "id": 4,
      "rect": [12,109,240,10],
      "flags": ["WS_CHILD","WS_VISIBLE","WS_TABSTOP","WS_HOTKEY"],
      "children": null
    },
    {
      "type": "CHECKBOX",
      "content": "video-5",
      "id": 5,
      "rect": [12,127,240,10],
      "flags": ["WS_CHILD","WS_VISIBLE","WS_TABSTOP","WS_HOTKEY"],
      "children": null
    },
    {
      "type": "SCROLLBAR",
      "content": "",
      "id": 6,
      "rect": [34,149,208,12],
      "flags": ["SBS_HORZ","WS_CHILD","WS_VISIBLE","WS_TABSTOP"],
      "children": null
    },
    {
      "type": "RADIOBUTTON",
      "content": "video-6",
      "id": 8,
      "rect": [12,175,240,10],
      "flags": ["WS_CHILD","WS_VISIBLE","WS_TABSTOP","WS_HOTKEY"],
      "children": null
    },
    {
      "type": "RADIOBUTTON",
      "content": "video-7",
      "id": 9,
      "rect": [12,199,240,10],
      "flags": ["WS_CHILD","WS_VISIBLE","WS_TABSTOP","WS_HOTKEY"],
      "children": null
    },
    {
      "type": "RADIOBUTTON",
      "content": "video-8",
      "id": 10,
      "rect": [12,223,240,10],
      "flags": ["WS_CHILD","WS_VISIBLE","WS_TABSTOP","WS_HOTKEY"],
      "children": null
    },
    {
      "type": "LTEXT",
      "content": "video-9",
      "id": -1,
      "rect": [12,44,208,14],
      "flags": ["WS_CHILD","WS_VISIBLE","WS_GROUP"],
      "children": null
    },
    {
      "type": "LTEXT",
      "content": "video-10",
      "id": -1,
      "rect": [32,74,80,12],
      "flags": ["WS_CHILD","WS_VISIBLE","WS_GROUP","RC_SMALLTEXT"],
      "children": null
    },
    {
      "type": "LTEXT",
      "content": "video-11",
      "id": 2,
      "rect": [32,163,80,12],
      "flags": ["WS_CHILD","WS_VISIBLE","WS_GROUP","RC_SMALLTEXT"],
      "children": null
    },
    {
      "type": "RTEXT",
      "content": "video-12",
      "id": -1,
      "rect": [166,74,80,12],
      "flags": ["WS_CHILD","WS_VISIBLE","WS_GROUP","RC_SMALLTEXT"],
      "children": null
    },
    {
      "type": "RTEXT",
      "content": "video-13",
      "id": 3,
      "rect": [166,163,80,12],
      "flags": ["WS_CHILD","WS_VISIBLE","WS_GROUP","RC_SMALLTEXT"],
      "children": null
    },
    {
      "type": "CTEXT",
      "content": "video-14",
      "id": -1,
      "rect": [0,8,264,24],
      "flags": ["WS_CHILD","WS_VISIBLE","WS_GROUP","RC_BIGTEXT"],
      "children": null
    }
  ]
}