{
  "type": "DIALOG",
  "name": "GameSel",
  "rect": [0,0,640,480],
  "style": ["DS_MODALFRAME","WS_POPUP","WS_BORDER","WS_SYSMENU"],
  "children": [
    {
      "type": "RECT",
      "content": "glue\\Load\\pList.pcx",
      "id": 1,
      "rect": [0,0,362,356],
      "flags": ["WS_VISIBLE","CTRL_TRANSLUCENT","RC_ANCHOR_TOPRIGHT"],
      "children": null
    },
    {
      "type": "RECT",
      "content": "glue\\PalNl\\pCancel.pcx",
      "id": 2,
      "rect": [472,356,168,91],
      "flags": ["WS_VISIBLE","CTRL_TRANSLUCENT"],
      "children": null
    },
    {
      "type": "RECT",
      "content": "glue\\PalNl\\pOk.pcx",
      "id": 3,
      "rect": [436,336,204,71],
      "flags": ["WS_VISIBLE","CTRL_TRANSLUCENT"],
      "children": null
    },
    {
      "type": "LTEXT",
      "content": "gluLoad-1",
      "id": -1,
      "rect": [40,68,136,20],
      "flags": ["WS_VISIBLE","RC_BIGTEXT"],
      "children": null
    },
    {
      "type": "LISTBOX",
      "content": "",
      "id": 6,
      "rect": [64,92,286,218],
      "flags": ["WS_VISIBLE","WS_TABSTOP","RC_BIGTEXT"],
      "children": null
    },
    {
      "type": "FLCBTN",
      "content": "gluLoad-2",
      "id": 4,
      "rect": [441,383,152,22],
      "flags": ["WS_VISIBLE","WS_TABSTOP","RC_BIGGERTEXT","WS_HOTKEY","FB_HTEXTCENTER","FB_VTEXTCENTER","CTRL_ENTER"],
      "children": null
    },
    {
      "type": "FLCBTN",
      "content": "gluLoad-3",
      "id": 5,
      "rect": [477,419,132,22],
      "flags": ["WS_VISIBLE","WS_TABSTOP","RC_BIGGERTEXT","WS_HOTKEY","FB_HTEXTCENTER","FB_VTEXTCENTER","CTRL_ESCAPE"],
      "children": null
    },
    {
      "type": "FLCBTN",
      "content": "gluLoad-4",
      "id": 7,
      "rect": [44,332,164,20],
      "flags": ["WS_VISIBLE","WS_TABSTOP","RC_BIGGERTEXT","WS_HOTKEY","FB_HTEXTCENTER","FB_VTEXTCENTER"],
      "children": null
    }
  ]
}