{
  "type": "DIALOG",
  "name": "JoinMultiBattlenet",
  "rect": [0,0,640,480],
  "style": ["DS_MODALFRAME","WS_POPUP","WS_BORDER","WS_SYSMENU"],
  "children": [
    {
      "type": "RECT",
      "content": "glue\\create\\pListMap4.dds",
      "id": 1,
      "rect": [0,0,372,356],
      "flags": ["WS_VISIBLE","CTRL_TRANSLUCENT","RC_ANCHOR_TOPRIGHT"],
      "children": null
    },
    {
      "type": "RECT",
      "content": "glue\\gamesel\\pJoin.dds",
      "id": 2,
      "rect": [400,0,240,333],
      "flags": ["WS_VISIBLE","CTRL_TRANSLUCENT"],
      "children": null
    },
    {
      "type": "RECT",
      "content": "glue\\PalNl\\pCancel.dds",
      "id": 3,
      "rect": [472,356,168,91],
      "flags": ["WS_VISIBLE","CTRL_TRANSLUCENT"],
      "children": null
    },
    {
      "type": "RECT",
      "content": "glue\\PalNl\\pOk.dds",
      "id": 4,
      "rect": [436,336,204,71],
      "flags": ["WS_VISIBLE","CTRL_TRANSLUCENT"],
      "children": null
    },
    {
      "type": "RECT",
      "content": "glue\\Chatroom\\pChat2.dds",
      "id": 5,
      "rect": [0,308,372,169],
      "flags": ["WS_VISIBLE","CTRL_TRANSLUCENT","RC_ANCHOR_TOPRIGHT"],
      "children": null
    },
    {
      "type": "WEBBROWSER",
      "content": "webui/dist/GameSearchPanel/GameSearchPanel.html",
      "id": 6,
      "rect": [42,65,330,260],
      "flags": ["WS_VISIBLE","WS_TABSTOP"],
      "children": null
    },
    {
      "type": "WEBBROWSER",
      "content": "webui/dist/GameSearchMapInfoPanel/GameSearchMapInfoPanel.html",
      "id": 7,
      "rect": [404,56,200,272],
      "flags": ["WS_VISIBLE"],
      "children": null
    },
    {
      "type": "WEBBROWSER",
      "content": "webui/dist/GlobalChatPanel/GlobalChatPanel.html",
      "id": 8,
      "rect": [20,334,344,140],
      "flags": ["WS_VISIBLE"],
      "children": null
    },
    {
      "type": "FLCBTN",
      "content": "gluJoinMultiBattlenet-1",
      "id": 9,
      "rect": [439,382,155,23],
      "flags": ["WS_VISIBLE","WS_TABSTOP","RC_BIGGERTEXT","WS_HOTKEY","CTRL_ENTER","FB_HTEXTCENTER","FB_VTEXTCENTER"],
      "children": null
    },
    {
      "type": "FLCBTN",
      "content": "gluJoinMultiBattlenet-2",
      "id": 10,
      "rect": [475,417,134,24],
      "flags": ["WS_VISIBLE","WS_TABSTOP","RC_BIGGERTEXT","WS_HOTKEY","CTRL_ESCAPE","FB_HTEXTCENTER","FB_VTEXTCENTER"],
      "children": null
    }
  ]
}