{
  "type": "DIALOG",
  "name": "HelpMenu",
  "rect": [184,32,264,288],
  "style": ["DS_MODALFRAME","WS_POPUP","WS_SYSMENU"],
  "children": [
    {
      "type": "DEFPUSHBUTTON",
      "content": "helpmenu-1",
      "id": -3,
      "rect": [20,252,224,28],
      "flags": ["WS_CHILD","WS_VISIBLE","WS_TABSTOP","WS_HOTKEY","RC_BIGTEXT"],
      "children": null
    },
    {
      "type": "PUSHBUTTON",
      "content": "helpmenu-2",
      "id": 1,
      "rect": [20,36,224,28],
      "flags": ["WS_CHILD","WS_VISIBLE","WS_TABSTOP","WS_HOTKEY","RC_BIGTEXT"],
      "children": null
    },
    {
      "type": "PUSHBUTTON",
      "content": "helpmenu-3",
      "id": 2,
      "rect": [20,70,224,28],
      "flags": ["WS_CHILD","WS_VISIBLE","WS_TABSTOP","WS_HOTKEY","RC_BIGTEXT"],
      "children": null
    },
    {
      "type": "CTEXT",
      "content": "helpmenu-4",
      "id": -1,
      "rect": [0,8,264,24],
      "flags": ["WS_CHILD","WS_VISIBLE","RC_BIGTEXT"],
      "children": null
    }
  ]
}