{
  "type": "DIALOG",
  "name": "GameName",
  "rect": [0,0,220,100],
  "style": ["DS_MODALFRAME","WS_POPUP","WS_SYSMENU"],
  "children": [
    {
      "type": "FLCBTN",
      "content": "gluNewCh-1",
      "id": 1,
      "rect": [13,75,90,20],
      "flags": ["WS_CHILD","WS_VISIBLE","WS_TABSTOP","WS_HOTKEY","FB_HTEXTCENTER","FB_VTEXTCENTER","CTRL_ENTER"],
      "children": null
    },
    {
      "type": "FLCBTN",
      "content": "gluNewCh-2",
      "id": 2,
      "rect": [119,75,90,20],
      "flags": ["WS_CHILD","WS_VISIBLE","WS_TABSTOP","WS_HOTKEY","FB_HTEXTCENTER","FB_VTEXTCENTER","CTRL_ESCAPE"],
      "children": null
    },
    {
      "type": "EDITTEXT",
      "content": "",
      "id": 3,
      "rect": [13,32,192,20],
      "flags": ["WS_VISIBLE","WS_TABSTOP","WS_EX_TRANSPARENT"],
      "children": null
    },
    {
      "type": "LTEXT",
      "content": "gluNewCh-3",
      "id": -1,
      "rect": [4,4,120,20],
      "flags": ["WS_CHILD","WS_VISIBLE","WS_GROUP","RC_SMALLTEXT"],
      "children": null
    }
  ]
}