{
  "type": "DIALOG",
  "name": "BattlenetRenameToonPopup",
  "rect": [0,0,360,200],
  "style": ["DS_MODALFRAME","WS_POPUP","WS_BORDER","WS_SYSMENU"],
  "children": [
    {
      "type": "RECT",
      "content": "glue\\Battlenet\\BlockingOperationPopup.dds",
      "id": 10,
      "rect": [0,0,360,200],
      "flags": ["WS_VISIBLE"],
      "children": null
    },
    {
      "type": "WEBBROWSER",
      "content": "webui/dist/ToonRenamePanel/ToonRenamePanel.html",
      "id": 11,
      "rect": [0,0,360,200],
      "flags": ["WS_VISIBLE"],
      "children": null
    }
  ]
}
